Speaker,Position,Content,Order
Andy Bryant, CFO," So it's a, when you start a new process, you typically have a little bit of variation that comes with i,t because you have the startup costs we're dealing with now, and before the product gets called, you have the pre-quality reserves, and then you end up starting at a point in time. So when we get in to Q2, I will give you better forecast of when those products may qualify and when you might start to see inventory being valued and the compensating margin effect. So I guess I am going to tell you I am not going to give you many specifics about that. Yes, we think that the cost on both of those products can be very competitive. We feel pretty good about where those are headed, but again, for this year it's more inventory valuation than it is cost of unit effect.",45
Chris Caso, Analyst, Right. How about from a technical side on a performance basis. You talked about the fact that you would increase the cache size of those 45-nanometer products. Should we also expect to see higher clock speeds out of those as well? Can you talk a little bit about what we can expect performance-wise from the 45-nanometer processors?,46
Paul Otellini," President,  CEO"," Sure. Let me back up a bit. You may recall on the last Analyst's meeting last April, I talked about a new cadence for development and deployment of technology, where we would continue our two-year technology deployment of silicon generations, and then have an alternative year cadence of new microarchitectures, and that we would ramp new silicon technologies with shrinks, or slight improvements of the existing microarchitecture, to be able to ramp very quickly with a high performance product with a small die size. What you saw in '06 was that new microarchitecture coming in on 65-nanometers. What you will see starting at the end of this year, with the beginning of the 45-nanometer shipments, are derivatives of that microarchitecture, shrunk if you will, to 45 nanometers with some new instructions, with some new feature sets, with some larger cache, and with some faster clock speed. All of that combines to give us a nice boost in performance, and I gave you a rage of 15 to 45%, depending on the application type and the product type. We are seeing a nice boost on the performance side, as well as a significant decrease in die size.",47
Chris Caso, Analyst," Okay. And just maybe last question. With regard to the ramp of those 45-nanometer products, I guess it is early, would you expect that to be about as fast, maybe faster or slower than the ramp of the Core2 Duo family of products?",48
Paul Otellini," President,  CEO",  It will be at least as fast as the 65-nanometer ramp was.,49
Chris Caso, Analyst, Great. Thank you.,50
Operator,Operator," Thank you, very much, sir. Your next question comes from the line of Tim Luke of Lehman Brothers. Please proceed.",51
Tim Luke, Analyst," Andy, just to clarify on the gross margin, so the gross margin in the First Quarter was elevated by a percentage point from the sale of previously reserved inventory, is that correct?",52
Andy Bryant, CFO, Correct.,53
Tim Luke, Analyst," And for the June period, your gross margin vis-a-vis some of the prior models that is moving to 48%, perhaps a little lower, but the second half, you are now raising, could you just walk through the key things that are raising the back half gross margin vis-a-vis what you were expecting previously? In that the First Quarter gross margin, if I am not mistaken, was broadly in-line excluding the reserve, with what you had expected and maybe--?",54
Andy Bryant, CFO, Careful. We knew that we were doing that when we began the forecast.,55
Tim Luke, Analyst," Oh, you did.",56
Andy Bryant, CFO," So what is happening is we are ahead on unit cost reductions. ASPs firmed up a little bit, versus if we had done the same math for everyone last time we did this, so this time you would have seen my Q2 margins actually a little elevated to where I thought it was at the beginning of the year. So I believe we are seeing some good news out of the operating of the business in both the first and Second Quarter. In the back half of the year, we expect to see, if you assume something along the lines of seasonal revenue pickup, fixed cost, and you pick up some margin for that. Versus our prior expectations, like I said we are ahead on unit costs, not just in the First Quarter, but that we stayed ahead during the year. We picked up a little bit of good news for that. We think the strength of the new products are starting to help us a little bit, we pick up a little bit of good news for that, so essentially the business is working like you would hope it would be working right now, plus you get the uplift for the startup costs. ",57
Tim Luke, Analyst," Then if I may just as a follow-up, we should think about you looking to build inventory as you move into the seasonally stronger second half, or how should we think about you managing your inventory levels as you move through the, and after the Second Quarter.",58
Andy Bryant, CFO," Again, what I would guess for the Second Quarter is up modestly a little bit, not much. You do start to build some inventory for revenue uplift, and that will start to happen, so you will see some increase, in reality I would love to keep it flat again, I just don't think that I would quite consider, it won't be a big change.",59
Tim Luke, Analyst," Thank you, very much.",60
Operator,Operator," Thank you, very much, sir. Ladies and gentlemen, your next question comes from the line of David Wong of A.G. Edwards. Please proceed.",61
David Wong, Analyst," Just a couple of clarifications on what you had said about pricing in the quarter. For notebooks, there was some amount, was it primarily stability of pricing, or was it also a mix to the higher end, and similarly when you talked about selling more Conroes, would desktop like-for-like prices, roughly stable as well?",62
Paul Otellini," President,  CEO", I'm not sure I understand the like-for-like. What I said was that the aggregate for notebooks and desktop was approximately flat for each of them quarter to quarter. There is a bit of a mix shift as we continue to drive Core2 Duo more rapidly and more broadly into the product line. At the same time we are also using our cost capability right now to participate pretty broadly across the market. The combination of that was flat ASPs in each of those segments.,63
David Wong, Analyst," What about for servers for identical products, again you talked a little bit to some about of mix shift--?",64
Paul Otellini," President,  CEO", It was almost entirely a mix shift.,65
David Wong, Analyst,"  Okay. Great. And your policy going forward. Do you anticipate needing to take any pricing actions, or are you finding you gaining share without a particular response to your competitor's prices?",66
Andy Bryant, CFO," We have always price moves scheduled in, right, and those are pretty well telegraphed across the industry, and the price moves are essential for us to be able to move our most advanced technology through the stack. So you will see us continue to have price moves. In terms of the overall average that really is a function of how well we can drive demand to the newer products.",67
David Wong, Analyst, Great. Thank you.,68
Operator,Operator," Thank you, very much, sir. Ladies and gentlemen, your next question comes from the line of Joe Osha of Merrill Lynch, please proceed.",69
Joe Osha, Analyst," Hi, folks. Congratulations on the solid execution. Listen, I look at this, your revenues flat on a year ago. Your gross margin is down by 500 bips, and you have added about $900 billion in inventory, 900 million. And you have reduced your competitor to rubble in the process. So I look at the second half of the year, and I guess my question is, in order to get to these numbers, do you need to have inventory continuing to grow faster than sales so you don't take any more inventory writedown charges, and capacity under absorption charges or any of these other things? I am just trying to figure out how things get even better than they are now, such that you don't have this continuing procession of problems absorbing your demand?",70
Andy Bryant, CFO," I am not sure what question you asked me. If you are asking me, do I have underload charges--",71
Joe Osha, Analyst," Let me rephrase that. I guess the question would be, do you need these under absorption charges and inventory writedowns to go away, to get you to these numbers that you are talking about?",72
Andy Bryant, CFO," Yes, of course. Our forecast assumes there are no underload charges, it assumes there are no unusual inventory reserves. If that doesn't happen and you do have underload charges, then you would have lower margins.",73
Joe Osha, Analyst,"  Do you need to add another, does inventory need to go to say 100 days or so, to drive this?",74
Andy Bryant, CFO," No, inventory-- no. Inventory could be dead flat and the same thing would happen, and inventory go could up and the same thing would happen.",75
Joe Osha, Analyst," The follow on then, is your confidence that the 65-nanometer process technology can absorb even as you ramp your 45-nanometer process technology?",76
Andy Bryant, CFO," Obviously we think we can, if the market is tougher than think, then we could end up with issues, but we do have, we actually do build plans out multiple years, and those build plans, our capacity is utilized.",77
Joe Osha, Analyst, Okay. And then Paul maybe you can help me with this one. I assume that the thought here is obviously you can't comment on your competition directly. But the market share trajectory that you have enjoyed so far as a result of your excellent execution continues for the remainder of the year.,78
Paul Otellini," President,  CEO"," I kind of hinted at that earlier, I said that we will leave the market share forecasting to the forecasters, but I am pretty well convinced that when the data rolls in a week or so, we will be very pleased with the answers.",79
Joe Osha, Analyst," One final one. As we look at 45-nanometer, should we assume that that kind of looks like a standard Intel ramp when we think about when you hit 65 versus 45 crossover?",80
Paul Otellini," President,  CEO", You bet.,81
Joe Osha, Analyst, Thanks very much.,82
Operator,Operator," Thank you, very much, sir. Ladies and gentlemen, your next question comes from the line of Sumit Dhanda of Banc of America Securities please proceed. ",83
Sumit Dhanda, Analyst," Andy could you, you talked about better unit costs, and the fact that it will come in progressively better versus the expectations for the remainder of the year. Can you sort of give us an idea relative to what you had indicated at your Analyst's day last April? #1 it is a material improvement versus what you (ph) where your unit costs peaked in Q3 of last year sort of down, and #2, is the fashion in which it comes down the same? In other words, it comes down in Q1, flattens out in Q2, and then comes down again in the back half? That is my question.",84
Andy Bryant, CFO," I am going to deduct most of your question, because I am showing the data in two weeks in New York anyway, and I will show you where we are versus last year's forecast, and you will see that the trend is the same and a little ahead. There was, probably the biggest quarter to quarter savings in cost unit for the year was in the First Quarter. We built on that in the Second Quarter, but not to the same amount. When I talked about the overall business, all pieces in being 2 points worth in the Second Quarter, part of that was the good news and the unit costs versus the First Quarter. So we continue to drive costs down steadily through the year. We got a nice big step function in the First Quarter, which was somewhat expected, somewhat of a surprise.",85
Sumit Dhanda, Analyst," I guess on that point, in terms of the unit cost benefiting you in Q2, I don't recollect you saying that. And you also indicated that the underload charges going away would benefit you by 2 points on top of the 1 point benefit in Q1. My recollection was that the total impact from those was only 2 points, so I guess I am confused, because you are suggesting a total benefit of 3 points when the underload charges were clearly-- initially--",86
Andy Bryant, CFO," So the charge in Q4 was more than 2 points. The charge, the benefit in Q1 was about 1 point. The benefit in Q2 rounds up to 2 points. Again, I am trying not to say 1.7 margin points for that, 1. for that, take my word for it, it goes from 2-plus points in the Third Quarter, to approximately zero in the Second Quarter.",87
Sumit Dhanda, Analyst," And the unit cost benefit in Q2 is less than a point, or--?",88
Andy Bryant, CFO," Again, we haven't quantified that and I don't plan to, what I think I said was if you take all of the pieces of, ""running the business"", that includes price, that includes volume, and it includes mix then there is unit costs, it is about 2 points worse in the Second Quarter, but cost of units is a benefit.",89
Sumit Dhanda, Analyst," Just a couple of more quick ones. On the, you said that 65 is basically almost all of the mix at this point on a microprocessor basis. Can you give us some sense, I think your forecast was for the 90/65 mix was to be about two-thirds/one-third by the end of last year. Where was this in Q1? Was it less than 10%, 90% at 90-nanometers if you are thinking about the mix of processors, or was it well above 10%? ",90
Andy Bryant, CFO," Boy, I, actually I know the answer is sitting in front of me, we are getting in to some pretty arcane questions, so I think I am going to pass on this one, unless you give me a better idea of what you are after.",91
Sumit Dhanda, Analyst," One final question, on Q2 is the forecast just basically on revenues hinging around what seasonality typically is, plus some conservatism as it relates to what the competition might do? There is nothing you could really point out from your OEM or your channel customer base that the majority of your inventory is built at any (inaudible)?",92
Andy Bryant, CFO," We think our inventories in the channels are just fine. And customers hands are just fine. I wouldn't say concerted, I would say caution around what is happening in the competitive space. So, yes, we are thinking of Second Quarter in terms of seasonal with some caution, because we think there is a little bit of excess inventory floating around the world.",93
Sumit Dhanda, Analyst," Thank you, very much.",94
Operator,Operator," Thank you, very much, sir. Your next question comes from the line of Krishna Shankar, JMP Securities, please proceed.",95
Krishna Shankar, Analyst," Yes, Paul, within the server space, is there anything unusual going on, in terms of the mix shift here, the move from NP to DP in unit processors, or is this just seasonal? And do you see any impact from virtualization in these trends?",96
Paul Otellini," President,  CEO"," I think that the overall shift to DP in particular, is one which is kind of the overarching trend in the industry over the last three or four years. That has picked up a bit, as we have shifted to dual and now quad-core products, because a quad-core DP is essentially a cheap (ph), with much of the robustness and very good price performance, and the power metrics are exceptional. So that's driving, I think, an overall trend away from MP towards DP in the industry, and that is going to modulate quarter by quarter, but for the most part that is the trend line that we operate on. You know, and in MP space, I think that really gets down to specific customers, specific product lines, and so forth, and I don't know that I want to comment on our customers, except to say that this overarching trend is one that we would expect to continue over the course of the year.",97
Krishna Shankar, Analyst," And impact of virtualization, do you see any (ph) of server demand? ",98
Paul Otellini," President,  CEO"," Yes, I forgot to grab that one. I don't actually think that is a problem. We actually like that trend because it helps, in the short-term I think it helps makes sure that people have up to date hardware to be able to run those virtualized environments. Second of all, when we look at the server demand over the next three or four years, we think the fundamental issue isn't virtualization, but rather adding sufficient capacity to do the job. One of the things we will talk about at the Analyst meeting in a couple of weeks, is that we believe that less than 5% of the servers that need to be deployed by 2010 are operating in the market today. So we still see significant growth in servers, despite a fairly positive trend around virtualization which helps make data centers more efficient.",99
Krishna Shankar, Analyst," My final question is on Vista, it sounds like it will eventually have any positive impact on Q1. What is your outlook for the second half of the year? And what the market reception is to Vista-loaded PCs.",100
Paul Otellini," President,  CEO"," My view hasn't changed from this call a quarter ago, which is that in the corporate space, I believe most companies will act like Intel. They are doing some pilots and testing today, but the deployment will actually happen when the service pack gets released in the Fourth Quarter timeframe. Probably the October/November timeframe. Most companies we believe are buying machines that are Vista ready today, if you will, at the enterprise level, and we think that is one of the advantages of the vPro ramp, that we will talk more about in two weeks at the Analyst meeting. In terms of consumers, essentially all the new consumer SKUs are Vista. So right now that is driving the numbers.",101
Krishna Shankar, Analyst, Thank you.,102
Operator,Operator," Thank you, very much, sir. Ladies and gentlemen, your next question comes from the line of Hans Mosesmann, Nollenberger Capital.",103
Hans Mosesmann, Analyst," Thanks, my questions have been answered.",104
Operator,Operator," Thank you, very much sir. Our next question comes from the line of Michael Masdea of Credit Suisse, please proceed.",105
Michael Masdea, Analyst," Thanks a lot. Andy you mentioned the magic word, differentiation, and you are seeing it in your products and it is starting to pay off a little bit. I guess the questions around that are what the key differentiating areas for either you or  Paul, and then also does that ultimately long-term change your cadence back to a level that we saw in the past, or does this cadence that you guys have established going to stay around for good?",106
Andy Bryant, CFO," Let me try that one, Michael. I think the near-term differentiation is clearly performance, performance per watt. And the activity we have done on segmentation optimization around power envelopes, and those kinds of things at the microprocessor level. A higher order of segmentation though, is the platform strategy. So Centrino, as we are now going into our fourth generation of Centrino with the Santa Rosa platform, is of course about the microprocessor, but also about other technologies coming in to it. We are refreshing other technologies at least at the rate of the microprocessor refresh, so this one has NAND technology on the motherboard for faster boot, faster application loading. It has got a new version of the WiFi chip, a new graphics engine in it for Crestline, and so forth. Similarly on the desktop, the vPro technology has been doing quite well in terms of driving higher end sell-up kinds of metrics in the enterprise, that we think will also now manifest themselves in the mobile marketplace.",107
Michael Masdea, Analyst," I guess the follow on which is really what I am getting at. If you are able to sustain this differentiation, which it looks like I believe you can do, is this should be a business where everybody thought 50 to 60% gross margin, and we are obviously at the lower end of the range on that. Has anything structurally changed, compared to what we saw in this industry has in the past in your opinion? Or do you think that, or do you think that we actually have seen some change in that, and we need to think about a different dynamic?",108
Andy Bryant, CFO," I don't think we are ready to make a long-term gross margin forecasts yet. We do believe the key to having improving, increasing, improving healthy returns is to have the best products, clearly and unquestionably. Which means the cadence Paul talked about, we won't go back, we will absolutely continue to drive the technology in both the architecture and in the manufacturing side.",109
Michael Masdea, Analyst," That is very helpful, thank you.",110
Operator,Operator," Thank you, very much, sir. Ladies and gentlemen, your next question comes from the line of Gurinder Kalra, Bear Stearns, please proceed.",111
Gurinder Kalra, Analyst," Thanks. I guess in terms of your upside for the second half for margins, what are your presumptions/costs on Barcelona, and it's comparative impact, and some similar or new products AMD might launch on desktops and notebooks? ",112
Paul Otellini," President,  CEO"," Well, we have yet to see a demo of Barcelona, so it's hard to understand the metrics here. But everything we have seen, or if we take the early indications, or early commentary at face value, I believe that we will be able to maintain our competitive lead in servers and in high-end desktops, in the face of the introduction of that product line, and even though it is a more competitive product line than they are shipping today, I think it is still going to get down to the ramp, and you will have to ask AMD about their plans to ramp the product.",113
Gurinder Kalra, Analyst," Any outlook for margins for the second half, you are assuming that the traction you are getting right now just continues to widen, despite AMD's product introductions?",114
Paul Otellini," President,  CEO", I am assuming that we will be able to maintain our competitive lead in all segments all year.,115
Gurinder Kalra, Analyst, Great. Thanks very much.,116
Operator,Operator," Thank you, very much sir. Ladies and gentlemen, your next question comes from the line of Ross Seymore, Deutsche Bank, please proceed.",117
Ross Seymore, Analyst," Thanks. Paul, earlier you mentioned that the channel side of the business was kind of better than seasonal in the First Quarter. What do you think is going on the channel side versus the OEM side, because I guess that would also imply given your overall business was seasonally a little weaker, that the OEM side was weaker than you may have expected.",118
Paul Otellini," President,  CEO"," The channel is obviously not terribly strong in selling notebooks. The white book business is not a large chunk of the market today. Where the channel excels is in selling very good value in terms of technology for the bang for the buck. They were early to grab Woodcrest and Clovertown, which is the dual and quad-core servers, and the white box server business has been doing quite well, particularly in North America, and we see them as I said earlier, ramping Conroe on the desktop, in some cases a little bit faster than some of the OEMs, which gives them an advantage in the marketplace, because of their cost effectiveness. So the combination of those two, is that you have got a quick-moving set of players in the channel, that are capitalizing on technology and winning business at the local level.",119
Ross Seymore, Analyst,"  Is that something that you, it doesn't sound like any of those metrics would change, as you go in to the second half of this year. Is that a fair assumption?",120
Paul Otellini," President,  CEO"," Well, their relative advantage over the large OEMs tends to mitigate over time, as the large ones shifts their product line, to have the same kind of profile, but other than that you start to see, the agility factor is still one that has been there historically.",121
Ross Seymore, Analyst," You mentioned a little bit just now about Woodcrest and Clovertown again, just overall when you said the ASPs are down in your server segment, if the mix is increasingly dominated by the Woodcrests and the Clovertowns, why would the ASPs be dropping?",122
Paul Otellini," President,  CEO", Why would they be dropping from quarter to quarter?,123
Ross Seymore, Analyst," Yes, if the mixes improves I would assume by more Woodcrests and more Clovertowns--",124
Paul Otellini," President,  CEO"," Because the MPs which are much higher price, become less of a share of the server business.",125
Ross Seymore, Analyst, Okay. So it is that simple thing. Go ahead.,126
Paul Otellini," President,  CEO", Go ahead.,127
Ross Seymore, Analyst," The final question was just on the R&D side of the equation. I noted that popping up, of course the M&A is coming down, so the net change is zero on the OpEx, but overall, Andy, if you could go a little bit in to what is happening on the R&D side please?",128
Andy Bryant, CFO," So kind of the exchange from before. What happens is we continue to believe we are a technology company, we  believe that is the lifeblood of Intel, so as we find ways we can save money in the non-R&D spaces, again rather like I  said before, rather than drive spending even lower, we would tend to reinvest it in the R&D side, and hold the 10.7 for  the year. With a little luck, we can see this happening again in the future.",129
Ross Seymore, Analyst, Great. Thank you.,130
Kevin Sellers," Director,  IR"," Bill, we are coming close to the bottom of the hour, we will take two more questions, please.",131
Operator,Operator, Your next question comes from the line of David Wu of Global Crown Capital. Please proceed.,132
