Speaker,Position,Content,Order
David Wu, Analyst," Yes. Good afternoon, thanks for taking my question. On the system-integrated business, are these people very flighty, in terms of adopting the latest hard technology, and therefore, if you gain market share in Q1 in these people, and presumably Q2 as well, is there risk that that same people who are quick to adopt new technology might so-called defect back to their, to the other people, to your competitor in the second half? And I was wondering whether the OEM business was a little weak in Q1? Because you obviously gained a lot of market share incrementally from AMD, and I don't see it in the Digital Enterprise space.",133
Paul Otellini," President,  CEO"," Well the systems integrators are typically relatively small companies. They live and die by the competitiveness of their product line. They have, move very rapidly to our products, and as long as we can continue to give them, A the best products, and B the best support, and critical to that support is our terms and conditions, our ability to supply in volume the parts they need when they need them, and not constrain them, I think that they will continue to do business with Intel. I am pretty confident about that. In terms of the mix shift to OEM versus channel, it wasn't that big of a swing, and I will take your back to Andy's earlier comment on overall revenue, which is that the microprocessor business was about where we expected it to be.",134
David Wu, Analyst," Your only competitor had a major shortfall in the unit volume, and I find it landed in your court, so I figured that if the system integrated business was unseasonably strong, than to get to your original target, the OEM business must be unseasonably week.",135
Paul Otellini," President,  CEO"," The relative scale a lot different, right. Our distribution business runs about 30% of our overall business.",136
David Wu, Analyst,  Okay.,137
Paul Otellini," President,  CEO", So it's not like it's 50/50.,138
David Wu, Analyst, I see. Thank you.,139
Operator,Operator," Thank you, very much, sir. Ladies and gentlemen, your last question comes from the line of James Covello of Goldman Sachs. Please proceed.",140
James Covello, Analyst," Thanks guys. Just a quick question on the NAND Flash business, obviously it has been difficult. We know what your guys are doing there with the Santa Rosa platform, but how do you think about the benefits from Santa Rosa versus some of the cash that is being spended out, and the returns that you could generate in the business long term, if the pricing stays kind of depressed here.",141
Paul Otellini," President,  CEO"," Well, we are still in the investment stage of this business, as you indicate, James. There is a lot of factory start-up costs, as we ramp up new facilities and as we migrate to more dense products. The NAND pricing environment in the last six months, actually the last three quarters has been particularly acute on the extreme aggressive side of the price curves. We have actually seen some firming up in the NAND pricing, in the last six weeks or so. I am not going to give you a forecast, but there is some cause for optimism that it has returned to more normal pricing curves.",142
James Covello, Analyst," And is there a point at which as you think about your experience that you have had in the NOR business over the last few years, is there a point at which the pricing would reaccelerate to the down side, that you guys might think about maybe scaling back on the committment a little bit, at least the level of committment?",143
Paul Otellini," President,  CEO"," No, we continue to look at that business quarter. We look at it every quarter, we look at it every time we make a capital commitment with our partner, Micron, and the business continues to have the right kind of NPV model, long term for us to continue to invest in.",144
James Covello, Analyst, Great. Thanks so much. ,145
Kevin Sellers," Director,  IR"," Okay. Thanks, Jim. We are going to conclude the call now. I would like to ask Paul to give a few closing comments as we do so. Paul?",146
Paul Otellini," President,  CEO"," Thanks, Kevin. And thank you all for your questions today. I wanted to leave you with a message that we have been highly focused on technology leadership and business efficiencies. We are seeing very good results in these areas, and I wanted to thank our employees for working hard, and staying laser-focused on these objectives. As you know, Intel's R&D pipeline extends many years in to the future. And we have much to share with you on May 3rd at our Analyst meeting in New York. Thank you, very much for your attendance today.",147
Operator,Operator," Thank you, very much, sir, and thank you, ladies and gentlemen, for your participation in today's conference call. This concludes your presentation. You may now disconnect your lines. Have a good day.",148
