Speaker,Position,Content,Order
Joanne Feeny, Analyst," Folks, just one last question on the spending side of the budget. With the restructuring that you're completing now, can we expect that to bring down in absolute terms your research and your selling budgets or is that likely to remain flat? Thank you.",117
Stacy Smith, CFO,"  Yes, our long term goals haven't changed which is to grow spending at a rate that's slower than revenue and have an expanding operating margin. In terms of the absolute spending level, that's going to be to a large extent dependent on the revenue environment that we're in. But the long-term goals here are the same that I communicated to you a month ago, it's grow operating margin % and have spending grow slower than revenue.",118
Joanne Feeny, Analyst, And would you say that after the restructuring you feel like you have more growth [ph] when conditions change you're able to reduce those variable costs a bit more quickly than in the past?,119
Stacy Smith, CFO, Could you repeat that question? There was a little bit of feedback on the line.,120
Joanne Feeny, Analyst," Sorry about that. Yes, I was just wondering given the restructuring has the firm become a bit more nimble. If demand goes down, can you cut out some of these expenses fairly quickly?",121
Stacy Smith, CFO," There's no question in my mind that we've become more nimble. I mean, the way we went about the restructuring and one of the reasons it's taken some time to do it is we tried to address the underlying efficiency of the company, the efficiency of our manufacturing organization, the efficiency of our research and development organization. So there's no question in my mind that we've addressed some of the underlying efficiency and frankly it's a focus that we will continue over the course of time even after the restructuring program that we announced two years ago goes away. I think it's an incredible competitive tool for us.",122
Joanne Feeny, Analyst, And that 250 million that we should expect this quarter you said it was likely to reduce over the course of the year. Is that something you're going to wind up you think this year or should that continue into next year as well?,123
Stacy Smith, CFO," We will continue to focus on efficiency and productivity hopefully forever. In terms of the restructuring program and the pretty significant charges you've been seeing hitting the restructuring line, I think they drop off pretty dramatically when we get into the second half of the year.",124
Joanne Feeny, Analyst," Okay, thanks very much.",125
Operator,Operator, Your next question comes from the line of Doug Freedman with American Tech Research. Please proceed. ,126
Doug Freedman, Analyst," Thanks for taking my questions. You've answered almost everything here but if you could, Stacy, talk a little bit about the impact of the Euro. You mentioned that it's impacting OpEx. But are there any benefits from the exchange rates that you're seeing and not just the Euro but anything that you can offer there?",127
Stacy Smith, CFO," Yes, absolutely. So, yes, the spending, as you mentioned, the weaker dollar is increasing our costs in some of the other geographies of the world. Two jobs ago I was actually the head for Europe, Middle East and Africa and one of my rules of thumb is the best time to be in that region is when the dollar is weak and the time to leave is when the dollar becomes strong because it does lower the PC prices in the marketplace and I think that's part of the strength that Paul alluded to in Q4 as we're just seeing the price of technology coming down in Europe because a lot of components are priced in dollars.",128
Doug Freedman, Analyst," And then can you talk about if you have seen any impact from what's happening in the commodities market and whether that is having an impact, expected to have an impact and how you're working that into your thinking?",129
Stacy Smith, CFO," Yes. I'd say it's the same as what we see on the macroeconomic side of the business. It's one of the inputs that goes into how we look at the business an how we look at our costs but, in general, what we're seeing and I think that this is a result of our technology leadership right now and the strength of our products we're seeing a pretty strong market and I see costs coming down quarter by quarter by quarter so those are kind of the two components there.",130
Doug Freedman, Analyst," And then lastly, you talked about success of Atom happening and you talked about strength in the server market and the drivers there. You also talked at the analyst day about the mix there being very important for gross margins going forward. Any help you can offer on how quick you think the Atom class processors are going to ramp in comparison to sort of where we're seeing pretty strong strength in the server market now? Is this something where the mix is going to become more of an issue for 2009? Anything you can offer there?",131
Stacy Smith, CFO," Yes, sure. Too early to call. My view hasn't changed from what I show you a month ago. We're pretty excited about the level of interest we're seeing on Atom. I think it is driving some incremental strength. But we're also seeing strength in the server business.",132
Paul Otellini, CEO, And I think it's fair to say that the 57% gross margin for the year you're projecting includes the impact of Atom for 2008. ,133
Stacy Smith, CFO, Yes. If that was your question absolutely.,134
Doug Freedman, Analyst, Okay.,135
Kevin Sellers," VP,  IR"," Doug real quick we've got to cut it, Denise we just need to take one more question because we're running out of time and it needs to be a quick one if you can just pull the last one and we'll wind up the call.",136
Operator,Operator," Yes, sir. Your next question comes from the line of John Lau from Jefferies & Company.",137
John Lau, Analyst," Great. Thank you, very much. Much of the questions have been answered. But in terms of the underlying dynamics for the PC, Paul, much of the growth is outside the United States now. Does the outsourcing trend and the infrastructure buildout in the emerging markets still look strong and is that really the dynamic that we're looking for to offset more of the mature markets in the United States and Europe?",138
Paul Otellini, CEO," Well, to the first approximation, yes, most of the growth over the next few years, five years is going to be, will be non-U.S. but the U.S. market has been pretty resilient based upon the transition to notebooks. People buy them more frequently than they do desktops and there's more notebooks per person. So, I wouldn't necessarily write it off. I think a notebook is becoming a bit of a fashion statement and that has a cache associated with it and we're seeing some of that. You certainly have seen that with the Apple product line growth. But I really think the unknown dynamic is what happens when these $200 to $300 Netbooks are unleashed in India and China and Indonesia and we don't, there is no model for that at this point in time because you're dealing with something that's never existed before so we're optimistic but we just don't know at this point.",139
John Lau, Analyst," And even before the Atom hits those emerging marketings, Paul, are you seeing, what can you comment with regards to the adoption rate for the middle class and the general population with regards to notebooks in these emerging markets now? Have you seen an uptick there?",140
Paul Otellini, CEO," Yes, it is. Some of that is also back to Stacy's last question on the dollar. As the dollar weakens against most currencies, particularly in some of these hot, emerging markets the amount of money it takes to buy a PC relative to local disposable income is less and less. And so we're seeing PC penetration move more rapidly in some of these markets than we had seen in previous years. And that's one of the reasons you see us pointing to a growth forecast in terms of  low double digits for the units this year.",141
John Lau, Analyst," Great. Thank you, very much.",142
Paul Otellini, CEO, You're welcome.,143
Operator,Operator, We have allotted the time for Q & A. I'll go ahead and turn the call back over to Mr. Kevin Sellers for closing remarks.,144
Kevin Sellers," VP,  IR"," Thank you, Denise. I want to thank everybody for joining the call today. As a reminder, our quiet period for the Second Quarter will begin at the close of business on May 30. And our Second Quarter earnings conference call is scheduled for Tuesday, July 15. Thanks again for joining and we'll talk to you soon. Good night.",145
Operator,Operator, Thank you for your participation in today's conference. This concludes the presentation. You may now disconnect. Have a great day.,146
