Speaker,Position,Content,Order
Paul Otellini, CEO," Well, we had I think a very, very good Q4 in Europe, as you may remember, Glen. And we had a very good Q1 in North America this time. So I'd look at the integral six months and say that from a macroeconomic standpoint the two most mature of our markets are not showing any signs of weakness. I was just in Europe two weeks ago meeting with customers and I did not pick up anything other than what I've indicated today.",36
Stacy Smith, CFO, It's also notable we had 8% year-on-year growth in Europe and that's pretty close to the average on a year-on-year basis so we saw growth across every geography in Q1 on a year-on-year basis.,37
Glen Yeung, Analyst," That good to know. Okay. Thanks. Second question is on unit costs in the Second Quarter. I think I heard one of the two of you say they would be down so I just want to double check that. And then I guess I'm trying to understand what's going on with 45 nanometer mix. I know you set a target at the beginning of the year, which I don't remember if you made public or not. But I know there was a target and I wonder if that target is now more than originally thought. And I guess an add-on question to this is what is 45 nanometer as a portion of inventories and does that sort of account for all of the, for where inventories are?",38
Stacy Smith, CFO," I'll take one and three and Paul will take two. Yes, I didn't break out costs for the Second Quarter. What I said was that you normally see the CPU business being slightly negative on the overall gross margin in the Second Quarter and we're really not seeing that in this Second Quarter. That's a comment on the strength of the business. Normally what you'd see is volumes down, costs down a bit. It causes the overall gross margin to be down a bit and we're not seeing that effect this time as we do the forecast for the Second Quarter so it's roughly flat on the overall Q2 gross margin. And on your question about 45 nanometer inventory, virtually all of the products that were put into inventory over the course of the First Quarter was new micro processor products so we look at that pretty carefully in terms of the age of products and it's a very healthy inventory level and the product that's in inventory is also very healthy product.",39
Glen Yeung, Analyst, Okay. ,40
Paul Otellini, CEO," And lastly on the mix, I did show that slide at the investor meeting. It shows a crossover in the Third Quarter and we are still on track to that. We're ramping as fast as we can and we've, I think I said at the analyst meeting, we have shipped in excess of 4 million units, at this point in time we've shipped in excess of 8 million units so we're moving very quickly up the ramp curve.",41
Glen Yeung, Analyst, That's great and just last question here for Stacy on the interest income line. I wonder if you could just walk us through the decline in that number going forward and just what's driving that.,42
Stacy Smith, CFO," Sure. I told you at the analyst meeting that our cash balances were a little higher than we wanted and higher than the target we set with the board. So talking through the Q1 to Q2 reduction, it really is driven by interest income and there's a couple components to that. As you know, interest rates are down so we earn a bit less on the portfolio that we have but also I plan to bring that cash balance down a bit more in the Second Quarter.",43
Glen Yeung, Analyst," All right, thanks.",44
Operator,Operator," And from UBS, your next question comes from the line of Uche Orji. Please proceed.",45
Uche Orji, Analyst," Hi. Thank you, very much. Paul, first question is for you. I'm just a little bit positively surprised by the comments you made on North America, especially on servers. If you don't mind I'd just like to probe that a little bit. My question is how much of this could have been the pent-up demand for 45 nanometer and, of course, I know it continues into Q2. But if you were to look through your various categories of customers, is there a particular area where the strength is coming from, I mean if I look at. And you mentioned Manhattan, if I look at financial services, of course, we're not seeing IT budgets going up. So if you can give us any more color just explain the strength, that would be very helpful.",46
Paul Otellini, CEO," Well, those questions may best be answered by Hewlett Packard an Dell and IBM when they come up but from our perspective as we look through I actually disagree with you on financial services. I think that you're right on the PC side. We have heard about some softness as the banks cut back employees and so fourth. But on the back office stuff, they're still deploying the most advanced technology they can to get for the obvious advantage of speed of transactions. So I take issue with your assertion there.",47
Uche Orji, Analyst, Okay. ,48
Paul Otellini, CEO," We saw pretty broad-based, wide customer based adoption of MP at a very strong ramp on Caneland and, as I said, the Quad-Core, especially 45 nanometer Quad-Core mix, accelerated over the quarter as our volume grew. We are, to mix your question and Glen's together on 45 nanometer, we're filling from the top. The bulk of our 45 nanometer output starts out in servers, moves to mobile and then moves to desktop.",49
Uche Orji, Analyst," Okay. Another question, thanks for that. That's helpful. Another question is regarding your pricing strategy. If I look at your strategic positioning, you are in the driver's seat. Is your strategy with pricing still for the rest of the year to kind of keep it flattish or do you have a chance now to kind of get people [ph] into higher speeds or higher ASP being the way to create more volume. So if I look through the rest of the year is it possible for you to talk through what will be ideal strategy for pricing? Of course I know it depends on what the environment looks like. But from your perspective any sense of what we should be thinking about pricing would be helpful.",50
Paul Otellini, CEO," I can assure you that we're always trying to sell up to the highest performing products in any of our segments so that's just standard operating procedure. When our mix is as competitive as it is today, we have a better chance of doing that. So look to try to see us move towards MP, towards faster Xeons, towards faster notebooks as much as possible. Offsetting that I have to say is. And this is the unknown, is the ramp of which things like the Netbook, the Atom based Netbooks start taking off which have a lower average selling price but as we've showed you in the analyst meeting awfully good margins and that segment we still think is going to, it will be net accretive to the overall TAM for notebooks.",51
Uche Orji, Analyst," Right. That's helpful. Thank you, very much, Paul. Appreciate it.",52
Operator,Operator, Your next question comes from the line of John Pitzer from Credit Suisse. Please proceed.,53
John Pitzer, Analyst," Yes. Thanks, guys. Congratulations. Paul, a couple questions. Just getting back to the macro. You said 75% of your business outside the U.S. on the server front I'm assuming there's a much higher concentration within the U.S. I'm just kind of curious, do you think market share gains or mix is a better driver because you've now had I guess three consecutive quarters Q3, Q4. And now Q1 where server demand has been extremely strong for you guys.",54
Paul Otellini, CEO," I think we'll let the MSS question sort itself out but I think it's probably a bit of both as it sorts out. One of the things that we've talked about is this growth of the large internet data centers who are now consuming a very measurable part of the server output and sometimes they buy from us directly and sometimes they buy through our OEM customers.  Their growth, I mean you saw the stories about Amazon and Google in the papers in the last couple of days. Their growth is really quite large as they try to build out their infrastructure for cloud computing and I think that is a driver that is measurably different in the last couple of quarters than in the previous few before that and on top of that you got the quality of the product line which may be helping on share.",55
John Pitzer, Analyst," And then, Paul, on the mobility side if you look over the last four quarters revenue growth is still very healthy but is decelerated from above 20% to now about 11.7. Is that all pricing and mix as you get into these new end markets? Is that the primary contributor there?",56
Paul Otellini, CEO, Yes. It's the predominant driver by far.,57
John Pitzer, Analyst," And then, Stacy, just two quick housekeeping questions around the NAND front. First, any money that you guys give to IMFT, does that show up in the $5.2 billion capital budget and can you give us a sense of how much capital you're planning to commit to that joint venture this year?",58
Stacy Smith, CFO," So it does not show up in the CapEx spending. So the $5.2 billion is what we're spending for our internal factories and as we push out the Singapore factory a bit, it's a little premature to say how much CapEx we'll do. It's likely to come down from what we thought a few weeks ago.",59
John Pitzer, Analyst," And then lastly just to help us given the pricing in NAND was an issue to Q1 gross margins, how much does NAND pricing have to fall in Q2 before we need to start to worry about your gross margin guidance for the quarter?",60
Stacy Smith, CFO," So probably best if I talk about what I see for the rest of the year and I'll give you a little bit of color commentary on what we saw Q4 to Q1 and then over the rest of the year. We see a continued oversupply in the NAND market. That's pretty consistent with what most of the external analysts are saying as well. So we do see pricing coming down on a gigabit level. We're taking some actions to improve our mix and our financial performance but we do see pricing coming down and also our costs come down. So it should be relatively gross margin neutral from here on out to what we have modeled in. The real difference is Q4 to Q1 our gigabit production doubled. We had a new factory that had come on line and we now see that kind of flattening out over the rest of the year. So even if there's a big drop in NAND pricing, it's not going to have the same magnitude on any given quarter as what we saw Q4 to Q1 because of that bit doubling that hit us the same time that the prices came down by half.",61
John Pitzer, Analyst,"  Great. Thanks, guys.",62
Operator,Operator, And Jim Covello from Goldman Sachs is on the line with your next question.,63
Jim Covello, Analyst," Great. Good afternoon. Thanks so much, guys. Stacy, first question. Can you help us quantify how much NAND is dragging down overall gross margins for the full year 2008?",64
Stacy Smith, CFO," More than we thought when we originally set the forecast for the quarter. But I'm not going to break it out. We had a big impact in Q1 and I think it's going to be pretty much gross margin neutral as we go through the year from where we are. Again, I've got costs coming down about the same rate that I see pricing coming down. And then we're also looking at series of other options to both improve our business on a tactical basis and if it's not going to give the kind of financial performance that we're holding it to, then we'll go take other options. So, I think that's all I can say on NAND right now.",65
Jim Covello, Analyst," That's helpful. And then relative to the margins in Q1 which were, as you said, were lower because of NAND and then the guidance for the full year gross margins remaining the same, what is helping in the back half of the year offset the weakness in the First Quarter?",66
Stacy Smith, CFO, It's not just the back half of the year. It's actually Q2 is up a bit from what I thought a quarter ago and what we're seeing is just some growing strength in the core business. Specifically I see some incremental growth coming from the Atom processor. I see costs coming down and that's offsetting the weakness that we're seeing in NAND.,67
Jim Covello, Analyst," Is it, I think you guys had commented on originally that some of the gross margin you had assumed for the year you were assuming a competitive product from your competitor and assuming some price competition as a result of that. Any possibility that some of that isn't as bad as you might have expected because of your product differentiation?",68
Stacy Smith, CFO, I think we'll have to wait and see as we get into the second half on how their products perform and the rate at which they're able to ramp it.,69
Jim Covello, Analyst,"  Okay. And then final question, just around the competitive environment. Obviously your product differentiation is creating a difficult situation for your competitors or your competitor. Is there a point at which the competitive environment gets too dire for them and how do you think about strategically your actions in the face of the competitive environment given how well you're doing and how poorly they 're doing?",70
Paul Otellini, CEO," I think you'll have to ask them the first part of that question. I don't think I'm qualified to answer it but in terms of the way we look at it, my job is simply to bring out the best products as possible and meet customer needs and drive dynamism in the marketplace in terms of new products and new technologies to kind of stimulate market growth. That's been the Intel CEO's job for two decades and I don't see it changing.",71
Stacy Smith, CFO, It's really stark if you look at the difference in our results back a year and a half ago when we didn't have product leadership to today when we do. It really drives a very different set of financial execution for us.,72
Jim Covello, Analyst, Great. Final question and then I'll be done. Hallum still on track?,73
Paul Otellini, CEO," Yes, sir.",74
Jim Covello, Analyst, Thanks very much.,75
Operator,Operator, Your next question comes from the line of Chris Danely of JP Morgan.,76
Chris Danely, Analyst," Thanks, guys. Can you talk about what utilization rates did in Q1 and where you expect them to go for the rest of the year, or is it that everything is kind of running flat out right now?",77
Stacy Smith, CFO," It's pretty much the same that I showed you at the analyst meeting about a month ago. Utilizations are what I would consider in the sweet spot over the course of 2008; not too hot, not too cold.",78
Chris Danely, Analyst,"  Great. And then, Stacy, it sounds like you're also going to deploy some more cash in Q2 so we can assume another buy back?",79
Stacy Smith, CFO," We have an ongoing buy back program. We did a good buy back in Q1. It was 2.5 billion. We paid a dividend and we actually announced an increase in our dividend. As I told you at the investor meeting, we'll utilize both of those mechanisms to keep cash at the level agreed with the board. Beyond that, I can't go any further in commenting on the First Quarter.",80
Chris Danely, Analyst, That's fine. It sounds like the NOR business is about $300 million. Why are you guys keeping $100 million in revenue for Q2 and then $50 million for Q3 and Q4?,81
Stacy Smith, CFO," So it's not that we're, we're actually supplying wafers to Numonyx on a supply agreement for some products in factories that they didn't take. And so that supply agreement will run the course over 2008, maybe a little bit at the beginning of 2009 and then it will be done.",82
Chris Danely, Analyst," Last question just for Paul. So, Paul, to reiterate, you've seen no troubling signs of demand either from the U.S. or Europe or Asia?",83
Paul Otellini, CEO," No, we haven't.",84
Chris Danely, Analyst, Thanks.,85
Operator,Operator, And your next question comes from the line of Tim Luke [ph]. Please proceed.,86
Unidentified Participant, Analyst," Thanks so much. Stacy, I was wondering with respect to the mobility business, it looked like what your outline strength in the server business in terms of the revenue and the profitability that while I think Paul was saying that your notebook business was strong relative to your expectation. The operating margin there looked lower clearly versus the Fourth Quarter but lower than it's been in a while. Do you have any color on the operating level there and what some of the issues might have been? ",87
Stacy Smith, CFO," Sure. And it's probably best seen, you can see the same impact year on year. So let me give you Q1 '07 to Q1 '08. It's best seen there and it really is the price of success for the mobile business. They pick up now a larger percentage of the allocated costs across the company. As Paul said, we're seeing that crossover point a year earlier than we thought. So they're picking up a larger percentage of the process technology development spending that we do that we allocate to the group so that's a chunk of it. We also made the decision to transition our advertising from the first half of last year where we're doing core 2 dual based advertising and is now Centrino business so they're picking up a much larger percentage of the overall advertising budget of the company. It really is those kinds of things that are impacting the operating margin.",88
Unidentified Participant, Analyst," Do you have any color, in saying the ASPs were flat, maybe the server ASPs were up because you had strong revenue and new product. How was the notebook ASP and maybe the desktop ASP?",89
Stacy Smith, CFO," Well, I pretty much said that notebook ASP in my speech, we saw notebook ASPs coming down some same as last quarter as the notebook form factors moving into the consumer segment in emerging markets. We see good strong unit growth and it is partially offset by the ASP coming down as it's hitting these new price segments of the market. That was true in Q1 as it was true in Q4.",90
Unidentified Participant, Analyst, The desktop ASP obviously lower as well?,91
Stacy Smith, CFO, So I'm not going to go segment by segment. The two significant ones was we saw good growth in the server market so good growth in units and the notebook market offset a little bit by ASP.,92
Unidentified Participant, Analyst," Going forward then the operating margin for the mobility business we would think about it being more in this mid to low 30s range, is that how we should think about it?",93
Stacy Smith, CFO," Going forward, their allocation over the, we're not making a new advertising decision so that's kind of all in, in the Q1 result. We do the allocation methodology on a semi-annual basis so it's probably going to look a little better as the revenue grows over the course of the year would be my guess.",94
Unidentified Participant, Analyst,"  Separately, just with respect to the chip set revenues versus the MPE revenues, it looks like the sequential decline in chip sets was more pronounced than the sequential decline in micro processors and similarly in the prior quarter the revenue growth had lagged, what it was in micro processors. Any color on some of the dynamics in chip sets for both enterprise and mobility versus micro processors?",95
Stacy Smith, CFO, Let me give an aggregate comment on chip sets and then maybe Paul wants to give color on the different segments I don't know.,96
Unidentified Participant, Analyst, Thanks.,97
Stacy Smith, CFO," Quarter, we had a very strong Q4 in chip sets. What we saw in Q1 in total on chip sets was pretty much as we expected in kind of within the wide range of outcomes that you typically see from a Q4 to Q1. So we didn't see anything unusual there. You also have to keep in mind that within that chip set and other revenue segment we had some revenue that's gone away. We were providing some supply agreements due to our divestiture of the handheld business. We had some other small divestitures hits that line item. So a little bit of what you're seeing is due to some of those effects and I articulated those at the beginning of the quarter.",98
Unidentified Participant, Analyst," Paul, anything on that Should we continue to expect chip sets to lag the micro processor revenue growth or is there going to be a catch-up at some point?",99
Paul Otellini, CEO," No, they lead and they lag. It depends on the season. In the second half of the year they tend to build up. There's about an 8 to 12 week, depending on the form factor, lead time of chip sets ahead of micro processors. So as you move towards the volume parts of the year the chip sets part to pick up in advance of micro processor seasonality and then when you come into this part of the year you have the trough because Q2 is typically lower than Q1. So I think what you're, I wouldn't read anything into that. Our view of our competitiveness in chip sets is unchanged. We think we have a very strong position here.",100
Unidentified Participant, Analyst," Lastly if I may, just on the NAND bit growth, I think at the analyst meeting, Stacy, you had suggested that the bit growth in NAND would be tempered or maybe even flattish going forward after a strong ramp in the first calendar quarter. Do you have any color there. And then separately, given the industry commentary around the battery fire impacting the notebook outlook, I was just wondering if, it doesn't seem like in your guidance there is any impact there at all. But I was just wondering if you had any color there on how we should think about that.",101
Paul Otellini, CEO,"  Sure. So on NAND consistent with what I said at the analyst meeting we saw incremental capacity coming on in Q4 and in Q1 that absolutely impacted our results. Over the course of the rest of the year, we don't have incremental capacity coming on. Our bits grow a little bit as yields improve but compared to what we saw last couple quarters that would be pretty minor. And we had the next increment of capacity coming on with the Singapore factory and in conjunction with Micron we've made a decision to push that out while we watch the market. In terms of the battery fire, our forecast encompasses what we see there. We aren't seeing that as an impact on the quarter.",102
Unidentified Participant, Analyst, Thanks. Good luck.,103
Operator,Operator, Hans Mosesmann from Raymond James is on the line with your next question.,104
Hans Mosesmann, Analyst," Thanks. Paul a quick question on the NAND situation. What is on the table with your discussions with Micron regarding possible action and in terms of that, could you possibly consider getting out of the NAND business completely?",105
Paul Otellini, CEO," Well, I really don't think it's appropriate to get into that, Hans. I mean, there's a lot of ideas that we have here and talking about them publicly before they're realized or discussed I think is inappropriate and weakens our negotiating position and our options. So I really can't comment on that prior to doing it. We have similar questions raised on NOR a year an a half ago about what are you going to do about it and we couldn't answer those even though we were in discussions with ST. So that's why I put the statement I made in my commentary on this has our focus and you have our commitment on the long-term non-drag on the business.",106
Hans Mosesmann, Analyst," Okay, fair enough. Thank you. That's it.",107
Operator,Operator," And from Cowen And Company, your next question comes from the line of John Barton. Please proceed.",108
John Barton, Analyst," Thank you, very much. Paul, as you start to see more design wins for the Atom roll in and you start the shipping for revenue, as you look at those wins is there anything that's changed in your view with respect to what the real adopters would be as far as either emerging economies, mature economies, MID's, notebooks? ",109
Paul Otellini, CEO," I think it's too soon to call that. Certainly some of the, I think the bulk of the early sales of the Netbooks has been in either in mature markets or tier 1 cities of places like China. And most people that are buying them are buying them as a fashion accessory, as a second or third notebook in the household, or women because of the form factor, both the keyboard is more amenable to their hand size or fits in a purse and those kinds of things. But I think we're in the early stage of this still. It's like the early days of the iPod. And as you have different versions come out and different price points come out, I would expect this to move, in particularly, well in emerging markets.",110
John Barton, Analyst," And as you review the design wins and the competitive dynamics out there, what actually do you see as the primary competition for an alternate processor choice and how do you think that potentially evolves through the following year?",111
Paul Otellini, CEO," Well you've seen some already. HP has one based upon Via [ph] already. So that's certainly one that's out there today. But in terms of the overall technology, in terms of performance and battery life and integration of chip sets, we think we're in a pretty good position to take advantage of the category we're creating.",112
John Barton, Analyst," With respect to overall PC demand, you were pretty adamant about your statements that the June quarter looks basically seasonal. You're not seeing anything to make you fearful of North America. Can I extrapolate from that that your view of 2008 really hasn't changed much since the last time you made a comment some I think you had low double digit PC unit growth shipments for '08, is that fair?",113
Stacy Smith, CFO, Yes. Yes it hasn't changed and yes that was our view at the time and I haven't moved from there.,114
John Barton, Analyst," Great. Thank you, very much.",115
Operator,Operator, And JoAnne Feeny from FTN Midwest is next.,116
